{
  "title": "HQE Incident Mini-Report",
  "type": "object",
  "properties": {
    "incident_id": {
      "type": "string"
    },
    "impacted_paths": {
      "type": "array",
      "items": {
        "type": "string"
      }
    },
    "evidence": {
      "type": "array",
      "items": {
        "type": "string"
      }
    },
    "indicators": {
      "type": "array",
      "items": {
        "type": "string"
      }
    },
    "containment": {
      "type": "array",
      "items": {
        "type": "string"
      }
    },
    "safe_verification": {
      "type": "array",
      "items": {
        "type": "string"
      }
    },
    "blockers": {
      "type": "array",
      "items": {
        "type": "string"
      }
    },
    "resume_criteria": {
      "type": "array",
      "items": {
        "type": "string"
      }
    }
  },
  "required": [
    "incident_id",
    "impacted_paths",
    "evidence",
    "containment"
  ],
  "additionalProperties": false,
  "$schema": "http://json-schema.org/draft-07/schema#"
}
